"PID,Name,Description,Tag,Capacity,Date_posted,NetID",,,,,
"1,AI Chatbot,Building an AI chatbot,AI,5,3/14/2024 12:00,asl123456",,,,,
"2,Web App,Developing a full-stack web app,Web,4,3/14/2024 14:00,jdx654321",,,,,
"3,Data Science,Analyzing datasets using Python,Data Science,6,3/15/2024 10:30,bmx987654",,,,,
"4,Game Dev,Creating an indie game,Unity,3,3/16/2024 16:45,cxr567890",,,,,
"5,Blockchain,Building a secure blockchain application,Blockchain,5,3/17/2024 9:20,dly345678",,,,,
"6,Mobile App,Developing a cross-platform mobile app,Mobile,4,3/18/2024 11:00,ekm789012",,,,,
"7,ML Model,Building a machine learning model for predictions,AI,3,3/18/2024 13:15,fgn890123",,,,,
"8,Database System,Creating an efficient database management system,Database,5,3/19/2024 9:45,goh901234",,,,,
"9,VR Experience,Developing a virtual reality application,VR,3,3/19/2024 15:30,hpi012345",,,,,
"10,Cybersecurity Tool,Building a network security tool,Security,4,3/20/2024 10:00,iqj123456",,,,,
"11,Cloud Storage,Creating a cloud-based file storage system,Cloud,5,3/20/2024 14:20,jrk234567",,,,,
"12,IoT Device,Developing a smart home IoT device,IoT,3,3/21/2024 11:45,ksl345678",,,,,
"13,Data Visualization,Creating interactive data visualizations,Data Science,4,3/21/2024 16:00,ltm456789",,,,,
"14,E-commerce Platform,Building an online store platform,E-commerce,5,3/22/2024 9:30,mun567890",,,,,
"15,AR Application,Developing an augmented reality app,AR,3,3/22/2024 14:45,nvo678901",,,,,
"16,Blockchain Wallet,Creating a secure cryptocurrency wallet,Blockchain,4,3/23/2024 10:15,owp789012",,,,,
"17,API Gateway,Building a microservices API gateway,Web,5,3/23/2024 15:30,pxq890123",,,,,
"18,Automation Script,Developing workflow automation scripts,Automation,3,3/24/2024 11:00,qyr901234",,,,,
"19,Neural Network,Implementing a deep neural network,AI,4,3/24/2024 16:15,rzs012345",,,,,
"20,Game Engine,Creating a custom game engine,Game Dev,5,3/25/2024 9:45,sat123456",,,,,
"21,Compiler,Building a programming language compiler,Systems,3,3/25/2024 14:00,tbu234567",,,,,
"22,Social Media App,Developing a new social media platform,Social,4,3/26/2024 10:30,ucv345678",,,,,
"23,Weather App,Creating a weather prediction application,Mobile,5,3/26/2024 15:45,vdw456789",,,,,
"24,Stock Analyzer,Building a stock market analysis tool,Finance,3,3/27/2024 11:15,wex567890",,,,,
"25,Fitness Tracker,Developing a health and fitness app,Health,4,3/27/2024 16:30,xfy678901",,,,,
"26,Language Translator,Creating a multilingual translation app,AI,5,3/28/2024 10:00,ygz789012",,,,,
"27,Music Player,Building a streaming music application,Media,3,3/28/2024 14:15,zha890123",,,,,
"28,Recipe App,Developing a recipe sharing platform,Food,4,3/29/2024 9:45,aib901234",,,,,
"29,Task Manager,Creating a productivity task manager,Productivity,5,3/29/2024 15:00,bjc012345",,,,,
"30,PDF Editor,Building a PDF manipulation tool,Utilities,3,3/30/2024 10:30,ckd123456",,,,,
"31,Calendar App,Developing a smart calendar application,Productivity,4,3/30/2024 14:45,dle234567",,,,,
"32,Email Client,Creating a custom email client,Communication,5,3/31/2024 9:15,emf345678",,,,,
"33,Video Editor,Building a video editing software,Media,3,3/31/2024 14:30,fng456789",,,,,
"34,Code Editor,Developing an IDE for programming,Development,4,4/1/2024 10:00,goh567890",,,,,
"35,Password Manager,Creating a secure password vault,Security,5,4/1/2024 15:15,hpi678901",,,,,
"36,Math Solver,Building an advanced math problem solver,Education,3,4/2/2024 11:45,iqj789012",,,,,
"37,Flashcard App,Developing a digital flashcard system,Education,4,4/2/2024 17:00,jrk890123",,,,,
"38,Job Board,Creating a job search platform,Employment,5,4/3/2024 10:30,ksl901234",,,,,
"39,Forum System,Building a discussion forum platform,Social,3,4/3/2024 15:45,ltm012345",,,,,
"40,Survey Tool,Developing an online survey creator,Research,4,4/4/2024 11:15,mun123456",,,,,
"41,File Converter,Creating a universal file converter,Utilities,5,4/4/2024 16:30,nvo234567",,,,,
"42,Meeting Scheduler,Building an automated meeting scheduler,Productivity,3,4/5/2024 10:00,owp345678",,,,,
"43,Expense Tracker,Developing a personal finance manager,Finance,4,4/5/2024 14:15,pxq456789",,,,,
"44,Book Reader,Creating an e-book reading app,Media,5,4/6/2024 9:45,qyr567890",,,,,
"45,Travel Planner,Building a trip planning application,Travel,3,4/6/2024 15:00,rzs678901",,,,,
"46,Photo Editor,Developing an image editing software,Media,4,4/7/2024 10:30,sat789012",,,,,
"47,Inventory System,Creating a retail inventory manager,Business,5,4/7/2024 15:45,tbu890123",,,,,
"48,Quiz App,Building an educational quiz platform,Education,3,4/8/2024 11:15,ucv901234",,,,,
"49,CRM System,Developing a customer relationship manager,Business,4,4/8/2024 16:30,vdw012345",,,,,
"50,Time Tracker,Creating a time management application,Productivity,5,4/9/2024 10:00,wex123456",,,,,
